{
  "$schema": "http://json-schema.org/draft-07/schema#",
  "$id": "https://vintrack.io/schemas/ticket",
  "title": "Ticket",
  "type": "object",
  "required": ["id", "milestone_id", "title", "domain", "capability", "purpose", "deliverables", "acceptance_criteria"],
  "properties": {
    "id": {
      "type": "string",
      "pattern": "^T[0-9]+\\.[0-9]+$",
      "description": "Ticket identifier, e.g. T1.1, T2.3"
    },
    "milestone_id": {
      "type": "string",
      "pattern": "^M[0-9]+$"
    },
    "title": {
      "type": "string",
      "minLength": 5
    },
    "domain": {
      "type": "string",
      "enum": ["Shared", "Identity", "Marketplace", "AI Intelligence", "Search", "Transactions", "Messaging", "Vault", "Notifications"]
    },
    "capability": {
      "type": "string",
      "description": "Capability group within the domain"
    },
    "purpose": {
      "type": "string",
      "minLength": 10
    },
    "dependencies": {
      "type": "array",
      "items": { "type": "string", "pattern": "^T[0-9]+\\.[0-9]+$" }
    },
    "architectural_constraints": {
      "type": "array",
      "items": { "type": "string" }
    },
    "deliverables": {
      "type": "array",
      "items": {
        "type": "object",
        "required": ["path", "description"],
        "properties": {
          "path": { "type": "string" },
          "description": { "type": "string" },
          "type": {
            "type": "string",
            "enum": ["file", "directory", "migration", "config", "test", "script", "other"],
            "default": "file"
          }
        }
      }
    },
    "acceptance_criteria": {
      "type": "array",
      "items": { "type": "string" },
      "minItems": 1
    },
    "traceability": {
      "type": "array",
      "description": "Commit-level traceability for this ticket",
      "items": {
        "type": "object",
        "required": ["commit_hash", "files_changed", "description", "timestamp"],
        "properties": {
          "commit_hash": { "type": "string" },
          "files_changed": {
            "type": "array",
            "items": { "type": "string" }
          },
          "description": { "type": "string" },
          "timestamp": { "type": "string", "format": "date-time" }
        }
      }
    },
    "git_commit": {
      "type": ["string", "null"],
      "description": "Final commit hash when ticket is completed"
    },
    "observability": {
      "type": "object",
      "properties": {
        "metrics": {
          "type": "array",
          "items": { "type": "string" }
        },
        "logs": {
          "type": "array",
          "items": { "type": "string" }
        },
        "traces": {
          "type": "array",
          "items": { "type": "string" }
        }
      }
    },
    "failure_modes": {
      "type": "array",
      "items": {
        "type": "object",
        "required": ["scenario", "mitigation"],
        "properties": {
          "scenario": { "type": "string" },
          "mitigation": { "type": "string" },
          "severity": {
            "type": "string",
            "enum": ["low", "medium", "high", "critical"]
          }
        }
      }
    },
    "estimated_hours": {
      "type": "number",
      "minimum": 0.5
    },
    "status": {
      "type": "string",
      "enum": ["planned", "in_progress", "review", "blocked", "completed"],
      "default": "planned"
    },
    "assignee": {
      "type": ["string", "null"],
      "description": "Agent or human owner"
    },
    "metadata": {
      "type": "object",
      "properties": {
        "created_at": { "type": "string", "format": "date-time" },
        "updated_at": { "type": "string", "format": "date-time" },
        "version": { "type": "integer", "minimum": 1 }
      }
    }
  }
}
