{
  "id": "T31.2",
  "milestone_id": "M31",
  "title": "CLI Dashboard Implementation",
  "domain": "Shared",
  "capability": "Governance Operability",
  "purpose": "Implement the CLI runtime dashboard that aggregates data from telemetry, events, state files, and audit logs into a unified operational view.",
  "dependencies": ["T31.1"],
  "architectural_constraints": [
    "Must not bypass governance event bus",
    "Must use storage adapter for all reads",
    "Must handle degraded states gracefully",
    "Must support filtering by severity, category, execution_id"
  ],
  "deliverables": [
    {
      "path": "scripts/runtime-dashboard.ts",
      "description": "Unified runtime dashboard CLI",
      "type": "script"
    },
    {
      "path": "meta/governance/protocols/dashboard-policy.json",
      "description": "Dashboard operational protocol",
      "type": "file"
    }
  ],
  "acceptance_criteria": [
    "Dashboard displays all 8 required views",
    "Updates in near-real-time (< 30s for critical metrics)",
    "Filtering by severity, category, execution_id works",
    "Degraded states handled gracefully (stale data warnings)",
    "npm run dashboard:start launches successfully",
    "Dashboard does not impact runtime performance > 5% CPU"
  ],
  "traceability": [],
  "estimated_hours": 6,
  "status": "planned",
  "assignee": null,
  "metadata": {
    "created_at": "2026-05-24T05:50:46Z",
    "updated_at": "2026-05-24T05:50:46Z",
    "version": 1,
    "governance_risk_classification": "HIGH",
    "blocks_scaling": true
  }
}
