{
  "id": "T29.3",
  "milestone_id": "M29",
  "title": "Replay Integrity Validator",
  "domain": "Shared",
  "capability": "Governance Stabilization",
  "purpose": "Implement the replay integrity validator that detects causal breaks, ordering ambiguity, orphaned events, duplicate lineage, and clock drift inconsistencies.",
  "dependencies": ["T29.2"],
  "architectural_constraints": [
    "Validation must be deterministic",
    "All integrity failures emit critical events",
    "Validator must operate on read-only event streams"
  ],
  "deliverables": [
    {
      "path": "scripts/validate-replay-integrity.ts",
      "description": "Replay integrity validator CLI",
      "type": "script"
    }
  ],
  "acceptance_criteria": [
    "Detects causal breaks in event streams",
    "Detects ordering ambiguity",
    "Detects orphaned events (no parent)",
    "Detects duplicate lineage",
    "Detects clock drift inconsistencies",
    "Deterministic validation outcomes",
    "Integrates with invariant engine (T27.2)"
  ],
  "traceability": [
    {
      "commit_hash": "TBD",
      "files_changed": [
        "scripts/validate-replay-integrity.ts",
        "scripts/lib/replay-integrity-validator.ts",
        "tests/scripts/replay-integrity-validator.test.ts",
        "meta/governance/invariants/invariants.json",
        "scripts/validate-invariants.ts",
        "package.json"
      ],
      "description": "Implemented replay integrity validator with 7 invariants (RI-001..RI-007), integrated with invariant engine",
      "timestamp": "2026-05-24T23:01:00Z"
    }
  ],
  "estimated_hours": 4,
  "status": "completed",
  "assignee": "agent",
  "metadata": {
    "created_at": "2026-05-24T05:50:46Z",
    "updated_at": "2026-05-24T23:01:00Z",
    "version": 2,
    "governance_risk_classification": "HIGH",
    "blocks_scaling": true
  }
}
