{
  "id": "T2.8",
  "milestone_id": "M2",
  "title": "Identity Integration Tests",
  "domain": "Identity",
  "capability": "Quality Assurance",
  "purpose": "Verify Identity domain end-to-end.",
  "dependencies": [
    "T2.1",
    "T2.2",
    "T2.3",
    "T2.4",
    "T2.5",
    "T2.6",
    "T2.7"
  ],
  "architectural_constraints": [
    "Test DB per run",
    "Transaction rollback per test",
    "RLS tested with authenticated role",
    "Service role for setup"
  ],
  "deliverables": [
    {
      "path": "src/identity/domain/entities/*.test.ts",
      "description": "Entity unit tests",
      "type": "test"
    },
    {
      "path": "src/identity/application/services/*.test.ts",
      "description": "Service unit tests",
      "type": "test"
    },
    {
      "path": "tests/integration/identity/*.test.ts",
      "description": "DB triggers, RLS, webhook integration tests",
      "type": "test"
    }
  ],
  "acceptance_criteria": [
    "Auth sync trigger creates user + profile",
    "Onboarding completion transitions seller status",
    "RLS prevents unauthorized access",
    "Webhook deduplication works",
    "Event emission verified"
  ],
  "traceability": [
    {
      "commit_hash": "pending",
      "files_changed": [
        "tests/setup-integration.ts",
        "tests/integration/identity/*.test.ts",
        "src/shared/outbox/postgres-adapter.ts",
        "supabase/migrations/20260519000001_create_outbox.sql",
        "src/identity/infrastructure/webhooks/supabase-auth-webhook.ts",
        "src/identity/domain/entities/__tests__/seller-profile.test.ts"
      ],
      "description": "Fixed integration test setup, outbox schema, RLS tests, webhook auth, seller-profile assertions",
      "timestamp": "2026-05-20T04:20:00Z"
    }
  ],
  "observability": {
    "metrics": [],
    "logs": [],
    "traces": []
  },
  "failure_modes": [],
  "estimated_hours": 4,
  "status": "completed",
  "assignee": "kimi",
  "metadata": {
    "created_at": "2026-05-19T02:31:57.300Z",
    "updated_at": "2026-05-20T04:20:00Z",
    "version": 1
  }
}
