{
  "id": "T3.2A",
  "milestone_id": "M3",
  "title": "Frontend CI/CD Integration",
  "domain": "Shared",
  "capability": "CI/CD Infrastructure",
  "purpose": "Add frontend build, lint, and E2E test jobs to the unified CI pipeline. Configure Vercel preview deployments for PRs.",
  "dependencies": ["T3.1"],
  "architectural_constraints": [
    "Single CI pipeline for all surfaces",
    "Frontend build must pass before merge",
    "Vercel preview on every PR",
    "E2E tests require both frontend build AND backend integration tests"
  ],
  "deliverables": [
    {
      "path": ".github/workflows/ci.yml",
      "description": "Updated with frontend-build, frontend-unit-tests, frontend-e2e-tests jobs",
      "type": "config"
    },
    {
      "path": "package.json",
      "description": "Added scripts: dev:frontend, build:frontend, lint:frontend",
      "type": "config"
    },
    {
      "path": "vercel.json",
      "description": "Vercel deployment configuration (if needed)",
      "type": "config"
    }
  ],
  "acceptance_criteria": [
    "CI runs frontend-build on every PR",
    "CI runs frontend-unit-tests on every PR",
    "CI runs frontend-e2e-tests when both frontend and backend are ready",
    "Vercel preview deployment succeeds for PRs",
    "Failed frontend build blocks PR merge",
    "Backend tests still pass unchanged"
  ],
  "traceability": [],
  "observability": {
    "metrics": [
      "ci_frontend_build_duration_seconds",
      "ci_frontend_e2e_duration_seconds"
    ],
    "logs": [],
    "traces": []
  },
  "failure_modes": [
    {
      "scenario": "Vercel preview fails due to missing env vars",
      "mitigation": "Document all required env vars in .env.example",
      "severity": "medium"
    },
    {
      "scenario": "E2E tests flaky in CI",
      "mitigation": "Retry logic, stable test data, isolated test environment",
      "severity": "medium"
    }
  ],
  "estimated_hours": 3,
  "status": "planned",
  "assignee": null,
  "metadata": {
    "created_at": "2026-05-19T10:00:00.000Z",
    "updated_at": "2026-05-19T10:00:00.000Z",
    "version": 1
  }
}
