{
  "id": "T1.3",
  "milestone_id": "M1",
  "title": "Outbox Pattern Implementation",
  "domain": "Shared",
  "capability": "Event Durability",
  "purpose": "Guarantee atomic DB commit + event emission via transactional outbox.",
  "dependencies": [
    "T1.2"
  ],
  "architectural_constraints": [
    "Outbox table in Postgres",
    "Poll interval 2s–5s",
    "Retry up to 10 times",
    "DLQ after exhaustion"
  ],
  "deliverables": [
    {
      "path": "src/shared/outbox/outbox.ts",
      "description": "Outbox insert/query interface",
      "type": "file"
    },
    {
      "path": "src/shared/outbox/relay-worker.ts",
      "description": "Polling relay worker",
      "type": "file"
    },
    {
      "path": "supabase/migrations/20260519000001_create_outbox.sql",
      "description": "Outbox table migration",
      "type": "migration"
    }
  ],
  "acceptance_criteria": [
    "DB mutation + outbox insert in same transaction",
    "Relay polls and publishes events",
    "Failed publishes retry with backoff",
    "DLQ receives exhausted events"
  ],
  "traceability": [
    {
      "commit_hash": "b54cfa1",
      "files_changed": [
        "src/shared/outbox/outbox.ts",
        "src/shared/outbox/relay-worker.ts",
        "supabase/migrations/20260519000001_create_outbox.sql",
        "src/shared/outbox/__tests__/outbox.test.ts",
        "src/shared/outbox/__tests__/relay-worker.test.ts"
      ],
      "description": "Implemented transactional outbox with relay worker, retry logic, DLQ routing, and Postgres migration",
      "timestamp": "2026-05-19T04:32:13.292Z"
    },
    {
      "commit_hash": "e068a21",
      "files_changed": [
        "src/shared/outbox/outbox.ts",
        "src/shared/outbox/relay-worker.ts",
        "supabase/migrations/20260519000001_create_outbox.sql",
        "src/shared/outbox/__tests__/outbox.test.ts",
        "src/shared/outbox/__tests__/relay-worker.test.ts",
        "project-knowledge/event-envelope-standard.md",
        "project-knowledge/queue-contracts.md"
      ],
      "description": "T1.3 amendments: added claimPending with optimistic locking, processing status, eventId idempotency contract, per-aggregate ordering docs, failure semantics, outbox-as-boundary governance",
      "timestamp": "2026-05-19T05:12:27.000Z"
    }
  ],
  "observability": {
    "metrics": [
      "outbox_backlog",
      "outbox_relay_latency_seconds"
    ],
    "logs": [],
    "traces": []
  },
  "failure_modes": [
    {
      "scenario": "Relay worker crash",
      "mitigation": "Auto-restart via process manager",
      "severity": "high"
    },
    {
      "scenario": "Event bus down",
      "mitigation": "Backlog grows, alert fires",
      "severity": "high"
    }
  ],
  "estimated_hours": 4,
  "status": "completed",
  "assignee": "Agent 1",
  "metadata": {
    "created_at": "2026-05-19T02:31:57.300Z",
    "updated_at": "2026-05-19T05:12:27.000Z",
    "version": 4
  },
  "git_commit": "b54cfa1"
}
