{
  "id": "T2.2B",
  "milestone_id": "M2",
  "title": "Auth Middleware + Lazy User Provisioning",
  "domain": "Identity",
  "capability": "Auth Boundary",
  "purpose": "API middleware verifies JWT via IdentityProvider, lazily provisions identity.users on first authenticated request, and attaches auth context to the request. This is the PRIMARY user provisioning path; webhooks are reconciliation only.",
  "dependencies": ["T2.1A", "T2.2A"],
  "architectural_constraints": [
    "First authenticated request provisions identity.users atomically",
    "Webhook is reconciliation mechanism, not primary provisioning",
    "JWT verification via JWKS, not Supabase SDK directly",
    "Auth context attached to AsyncLocalStorage or request object",
    "Correlation ID propagated from JWT or generated"
  ],
  "deliverables": [
    {
      "path": "src/identity/api/middleware/auth-middleware.ts",
      "description": "Verify JWT, lazy provision user, attach auth context",
      "type": "file"
    },
    {
      "path": "src/identity/application/services/lazy-provision-user.ts",
      "description": "Atomic user creation on first auth request",
      "type": "file"
    },
    {
      "path": "src/identity/api/middleware/__tests__/auth-middleware.test.ts",
      "description": "Unit tests with mocked IdentityProvider and JWT",
      "type": "test"
    }
  ],
  "acceptance_criteria": [
    "Valid JWT → identity.users row exists (created if missing)",
    "Invalid JWT → 401 with clear error code",
    "Expired JWT → 401",
    "Missing identity.users row → auto-created with auth_provider='supabase'",
    "Auth context contains userId, email, authProvider",
    "Correlation ID propagated from request header or generated",
    "No Supabase SDK import outside infrastructure/auth/"
  ],
  "traceability": [],
  "observability": {
    "metrics": ["identity_auth_middleware_latency_seconds"],
    "logs": ["Lazy provision success/failure", "JWT verification failure reason"],
    "traces": []
  },
  "failure_modes": [
    {
      "scenario": "JWT valid but identity.users creation fails",
      "mitigation": "Return 500, log error, do not cache failed state",
      "severity": "high"
    },
    {
      "scenario": "Concurrent first requests race to create user",
      "mitigation": "UNIQUE constraint on id + idempotent INSERT ... ON CONFLICT",
      "severity": "medium"
    }
  ],
  "estimated_hours": 3,
  "status": "planned",
  "assignee": null,
  "metadata": {
    "created_at": "2026-05-19T13:00:00.000Z",
    "updated_at": "2026-05-19T13:00:00.000Z",
    "version": 1
  }
}
