{
  "id": "T35.2",
  "milestone_id": "M35",
  "title": "Documentation Generator Implementation",
  "domain": "Shared",
  "capability": "Governance Documentation",
  "purpose": "Implement the documentation generator that produces role-oriented operational manuals from canonical runtime definitions with automatic cross-linking.",
  "dependencies": ["T35.1"],
  "architectural_constraints": [
    "Generates from canonical JSON, not manual prose",
    "Embeds schema, protocol, and invariant references",
    "Cross-links automatically where possible",
    "Deterministic output"
  ],
  "deliverables": [
    {
      "path": "scripts/generate-docs.ts",
      "description": "Documentation generator CLI",
      "type": "script"
    },
    {
      "path": "meta/governance/protocols/documentation-generation.json",
      "description": "Documentation generation protocol",
      "type": "file"
    }
  ],
  "acceptance_criteria": [
    "Generates all 10 documentation categories",
    "Embeds schema references",
    "Embeds protocol references",
    "Embeds invariant references",
    "Cross-links between related sections",
    "Deterministic output (same input → same hash)",
    "npm run docs:generate passes"
  ],
  "traceability": [],
  "estimated_hours": 6,
  "status": "planned",
  "assignee": null,
  "metadata": {
    "created_at": "2026-05-24T05:50:46Z",
    "updated_at": "2026-05-24T05:50:46Z",
    "version": 1,
    "governance_risk_classification": "HIGH",
    "blocks_scaling": true
  }
}
